{"format":"weave.delta.v2","operation_id":"018f0000-0000-7000-8000-000000000001","actor_id":"replica-a","actor_sequence":42,"canonicalization":"weave.canonical-json.v1","operation_sha256":"3b6303d368b88e9129e9e13300e64cf2e59e84bde0750284969c839197fc6ca4","payload":{"entity":{"kind":"node","id":"wv-123abc"},"mutation":{"kind":"node_patch","fields":{"status":{"expected":"todo","value":"active"},"claimed_by":{"expected":null,"value":"agent-a"}}}}}
